[
  {
    "id": "7765743d-200e-43f9-a3fb-d2cc85824451",
    "createdAt": "2026-08-20T09:25:50.833Z",
    "updatedAt": "2026-08-21T11:53:03.688Z",
    "title": "2026년 용산구 청년기업 융자지원사업",
    "agency": "용산구청",
    "agencyType": "public",
    "category": "loan",
    "summary": "용산구에 6개월 이상 거주 중이며, 용산구에 사업자등록을 한 39세 이하 청년 기업인 대상으로 저금리 융자지원사업을 실시합니다. 자세한 사항은 공고문으로 확인하시기 바랍니다.",
    "applyStartAt": "2026-01-26T15:00:00.000Z",
    "applyEndAt": "2026-11-30T14:59:59.000Z",
    "amountMin": null,
    "amountMax": null,
    "applicantTypes": [
      "preliminary",
      "individual",
      "corporate"
    ],
    "recurrence": "once",
    "targetRegions": [
      "서울"
    ],
    "targetIndustries": [],
    "minBusinessYears": null,
    "maxBusinessYears": 10,
    "maxEmployees": null,
    "maxRevenue": null,
    "requiredCertifications": [],
    "applyTargetDetail": "용산구에서 6개월 이상 거주 중이며, 용산구에 사업자등록을 한 39세 이하 청년(신청일 기준)",
    "excludeTarget": "최근 5년 이내 용산구에 설치된 다른 자금 융자실적이 있는 업체\r\n일반유흥음식점, 무도유흥음식점, 기타 사행시설 관리 및 운영업 등 제외",
    "minAge": 20,
    "maxAge": 39,
    "corporationOnly": null,
    "sourceUrl": "https://www.k-startup.go.kr/web/contents/bizpbanc-ongoing.do?schM=view&pbancSn=176090",
    "sourceApi": "kstartup",
    "externalId": "176090",
    "rawMetadata": {
      "contact": "0221994512",
      "rawRegion": "서울",
      "targetAge": "만 20세 이상 ~ 만 39세 이하",
      "department": "일자리정책담당관",
      "rawCategory": "융자ㆍ보증",
      "preferential": null,
      "excludeTarget": "최근 5년 이내 용산구에 설치된 다른 자금 융자실적이 있는 업체\r\n일반유흥음식점, 무도유흥음식점, 기타 사행시설 관리 및 운영업 등 제외\r\n",
      "rawApplyTarget": "대학생,일반인,일반기업,1인 창조기업",
      "integratedNotice": "N",
      "rawBusinessYears": "예비창업자,1년미만,2년미만,3년미만,5년미만,7년미만,10년미만",
      "applyTargetDetail": "용산구에서 6개월 이상 거주 중이며, 용산구에 사업자등록을 한 39세 이하 청년(신청일 기준)"
    },
    "isActive": true
  },
  {
    "id": "cb09c1ef-c735-4a4b-aef1-8d6865be5af2",
    "createdAt": "2026-08-20T09:25:27.164Z",
    "updatedAt": "2026-08-21T11:53:03.688Z",
    "title": "[종로여성인력개발센터] 2026년 청년일자리도약장려금 참여기업 모집 공고",
    "agency": "(사)여성중앙회 종로여성인력개발센터",
    "agencyType": "private",
    "category": "employment",
    "summary": "안녕하세요. 종로여성인력개발센터 일자리사업팀입니다.\r\n본 기관은 서울고용센터(관할: 서울시 중구, 종로구, 동대문구) 소속 민간위탁기관으로 다양한 고용서비스 사업을 운영하고 있습니다.\r\n기업과 청년의 동반 도약을 위해 정부가 지원하는「2026년 청년일자리도약장려금」사업을 안내드리오니, 많은 참여 부탁드립니다.",
    "applyStartAt": "2026-03-23T15:00:00.000Z",
    "applyEndAt": "2026-12-31T14:59:59.000Z",
    "amountMin": null,
    "amountMax": null,
    "applicantTypes": [
      "preliminary",
      "individual",
      "corporate"
    ],
    "recurrence": "once",
    "targetRegions": [
      "서울"
    ],
    "targetIndustries": [],
    "minBusinessYears": null,
    "maxBusinessYears": 10,
    "maxEmployees": null,
    "maxRevenue": null,
    "requiredCertifications": [],
    "applyTargetDetail": "□ 서울시 중구, 종로구, 동대문구 소재 기업\r\n\r\n□ 기업:  5인 이상 우선지원대상 기업 \r\n   - 참여 신청 직전 월부터 이전 1년간 평균 고용보험 피보험자 수가 5인 이상\r\n   - 지식서비스산업·문화콘텐츠산업·청년창업기업 등 1인 이상~5인 미만 가능\r\n   - 연매출액 '기준 피보험자 수×1,900만원' 이상 (업력 1년 미만, 면세법인사업자 심사 제외)\r\n\r\n□ 청년: 만 34세 이하 취업애로유형 청년 (*아래 유형 중 1가지 해당)\r\n     * 4개월 이상 실업, 고졸 이하 학력, 국민취업지원제도 참여, 최종학교 졸업 후 고용보험 가입기간 12개월 미만 등\r\n    - 근로조건: 정규직, 주 28시간 이상 근무, 최저임금 이상, 월평균 급여 450만원 이하",
    "excludeTarget": "□ 기업:  청년 채용일로부터 3개월 이내 인위적감원 발생 기업\r\n                 \r\n□ 청년: 사업자등록한 자, 재학생(휴학 포함), 동일(관련) 기업 1년 내 재입사자",
    "minAge": 20,
    "maxAge": 39,
    "corporationOnly": null,
    "sourceUrl": "https://www.k-startup.go.kr/web/contents/bizpbanc-ongoing.do?schM=view&pbancSn=176856",
    "sourceApi": "kstartup",
    "externalId": "176856",
    "rawMetadata": {
      "contact": "07040486709",
      "rawRegion": "서울",
      "targetAge": "만 20세 이상 ~ 만 39세 이하",
      "department": "고용서비스사업부 일자리사업팀 ",
      "rawCategory": "인력",
      "preferential": null,
      "excludeTarget": "\r\n□ 기업:  청년 채용일로부터 3개월 이내 인위적감원 발생 기업\r\n                 \r\n□ 청년: 사업자등록한 자, 재학생(휴학 포함), 동일(관련) 기업 1년 내 재입사자 ",
      "rawApplyTarget": "일반기업",
      "integratedNotice": "N",
      "rawBusinessYears": "예비창업자,1년미만,2년미만,3년미만,5년미만,7년미만,10년미만",
      "applyTargetDetail": "\r\n□ 서울시 중구, 종로구, 동대문구 소재 기업\r\n\r\n□ 기업:  5인 이상 우선지원대상 기업 \r\n   - 참여 신청 직전 월부터 이전 1년간 평균 고용보험 피보험자 수가 5인 이상\r\n   - 지식서비스산업·문화콘텐츠산업·청년창업기업 등 1인 이상~5인 미만 가능\r\n   - 연매출액 &apos;기준 피보험자 수×1,900만원&apos; 이상 (업력 1년 미만, 면세법인사업자 심사 제외)\r\n\r\n□ 청년: 만 34세 이하 취업애로유형 청년 (*아래 유형 중 1가지 해당)\r\n     * 4개월 이상 실업, 고졸 이하 학력, 국민취업지원제도 참여, 최종학교 졸업 후 고용보험 가입기간 12개월 미만 등\r\n    - 근로조건: 정규직, 주 28시간 이상 근무, 최저임금 이상, 월평균 급여 450만원 이하\r\n\r\n\r\n"
    },
    "isActive": true
  },
  {
    "id": "45d94001-7c7e-4d80-a76b-6ad3a6e36f6b",
    "createdAt": "2026-08-20T09:25:24.014Z",
    "updatedAt": "2026-08-21T11:53:03.688Z",
    "title": "부산 관광ㆍ마이스 그로우업(Grow-up) 지원사업",
    "agency": "(사)부산경영자총협회",
    "agencyType": "private",
    "category": "funding",
    "summary": "부산 관광·마이스 산업 분야 지원사업을 다음과 같이 공고하오니, 참여를 희망하는 기업은 안내에 따라 신청하시기 바랍니다.",
    "applyStartAt": "2026-03-16T15:00:00.000Z",
    "applyEndAt": "2026-12-31T14:59:59.000Z",
    "amountMin": null,
    "amountMax": null,
    "applicantTypes": [
      "individual",
      "corporate"
    ],
    "recurrence": "once",
    "targetRegions": [
      "부산"
    ],
    "targetIndustries": [],
    "minBusinessYears": null,
    "maxBusinessYears": 10,
    "maxEmployees": null,
    "maxRevenue": null,
    "requiredCertifications": [],
    "applyTargetDetail": "사업자등록증상 부산 소재 관광ㆍ마이스 유관 기업",
    "excludeTarget": "모집 공고문 참조",
    "minAge": 20,
    "maxAge": 39,
    "corporationOnly": null,
    "sourceUrl": "https://www.k-startup.go.kr/web/contents/bizpbanc-ongoing.do?schM=view&pbancSn=176953",
    "sourceApi": "kstartup",
    "externalId": "176953",
    "rawMetadata": {
      "contact": "0513289381",
      "rawRegion": "부산",
      "targetAge": "만 20세 이상 ~ 만 39세 이하",
      "department": "지역일자리팀",
      "rawCategory": "사업화",
      "preferential": null,
      "excludeTarget": "모집 공고문 참조",
      "rawApplyTarget": "일반기업",
      "integratedNotice": "N",
      "rawBusinessYears": "1년미만,2년미만,3년미만,5년미만,7년미만,10년미만",
      "applyTargetDetail": "사업자등록증상 부산 소재 관광ㆍ마이스 유관 기업"
    },
    "isActive": true
  },
  {
    "id": "4c5b82c7-1a08-4a1e-ac50-0bd55ea10a9a",
    "createdAt": "2026-08-20T09:25:47.337Z",
    "updatedAt": "2026-08-21T11:53:03.688Z",
    "title": "2026 신개념 세대융합 청년창업 지원 멘티 상시 모집",
    "agency": "인천창조경제혁신센터",
    "agencyType": "public",
    "category": "education",
    "summary": "중장년 전문가들의 경험과 노하우를 활용하여, 인천광역시 청년 창업가들이 기.술.창.업 과정에서 마주하는 어려움을 해결할 수 있도록 지원하는 이번 모집에 많은 참여바랍니다.",
    "applyStartAt": "2026-02-03T15:00:00.000Z",
    "applyEndAt": "2026-11-30T14:59:59.000Z",
    "amountMin": null,
    "amountMax": null,
    "applicantTypes": [
      "preliminary",
      "individual",
      "corporate"
    ],
    "recurrence": "once",
    "targetRegions": [
      "인천"
    ],
    "targetIndustries": [],
    "minBusinessYears": null,
    "maxBusinessYears": 3,
    "maxEmployees": null,
    "maxRevenue": null,
    "requiredCertifications": [],
    "applyTargetDetail": "- 연령: 만39세 이하 (1987년 1월 1일 이후 출생)\r\n- 기업업력: 예비창업자 또는 3년 이내 (2023년 2월 이후 창업) 창업자\r\n(예비창업자) 신청자 명의의 사업자 등록이 없는 자로 주민등록상 거주지가 인천인 자\r\n(기창업자) 사업자등록증 기준, 사업장 소재지가 인천에 위치한 3년 이내 창업자",
    "excludeTarget": "? 지원 제외 업종\r\n소상공인 분야 (예: 도소매업, 유통업, 요식업, 미용업 프랜차이즈 등)",
    "minAge": null,
    "maxAge": 39,
    "corporationOnly": null,
    "sourceUrl": "https://www.k-startup.go.kr/web/contents/bizpbanc-ongoing.do?schM=view&pbancSn=176208",
    "sourceApi": "kstartup",
    "externalId": "176208",
    "rawMetadata": {
      "contact": "0324585036",
      "rawRegion": "인천",
      "targetAge": "만 20세 미만,만 20세 이상 ~ 만 39세 이하",
      "department": "창업생태계팀",
      "rawCategory": "멘토링ㆍ컨설팅ㆍ교육",
      "preferential": null,
      "excludeTarget": "? 지원 제외 업종\r\n소상공인 분야 (예: 도소매업, 유통업, 요식업, 미용업 프랜차이즈 등)\r\n",
      "rawApplyTarget": "청소년,대학생,일반인,대학,연구기관,일반기업,1인 창조기업",
      "integratedNotice": "Y",
      "rawBusinessYears": "예비창업자,1년미만,2년미만,3년미만",
      "applyTargetDetail": "- 연령: 만39세 이하 (1987년 1월 1일 이후 출생)\r\n- 기업업력: 예비창업자 또는 3년 이내 (2023년 2월 이후 창업) 창업자\r\n(예비창업자) 신청자 명의의 사업자 등록이 없는 자로 주민등록상 거주지가 인천인 자\r\n(기창업자) 사업자등록증 기준, 사업장 소재지가 인천에 위치한 3년 이내 창업자\r\n"
    },
    "isActive": true
  },
  {
    "id": "01c59965-e14f-4d30-917b-e52b84f14d0c",
    "createdAt": "2026-08-20T09:25:07.376Z",
    "updatedAt": "2026-08-21T11:53:03.688Z",
    "title": "2026 중소기업AI훈련 맞춤 컨설팅 100% 정부지원 프로그램 참여기업 모집모집",
    "agency": "중소기업AI훈련확산센터대한상공회의소경기인력개발원",
    "agencyType": "public",
    "category": "rnd",
    "summary": "중소기업 AI 도입 및 활용 지원사업 참여기업 모집」을 다음과 같이 공고하오니, AI 기반 업무혁신 및 디지털 전환을 희망하는 기업의 많은 관심과 참여 바랍니다.\r\n\r\n\r\n본 사업은 AI 도입 및 활용에 어려움을 겪고 있는 중소기업을 대상으로, 기업별 상황과 수요에 맞춘 맞춤형 AI 훈련과 컨설팅을 지원하는 프로그램입니다. \r\n단순한 이론 교육이 아닌 실제 업무에 적용할 수 있는 실무 중심의 교육과 프로젝트(PBL) 방식으로 운영되며, 기업진단부터 현황분석, 과제도출, 역량강화 교육, 실무 적용까지 전 과정을 체계적으로 지원합니다. 또한 기업 맞춤형 AI 도입 전략과 훈련 로드맵 수립을 통해 기업의 디지털 전환과 업무 효율 향상을 돕고, 현업에 바로 적용 가능한 AI 활용 역량 강화를 목표로 합니다. \r\n참여 기업에는 컨설팅 비용 100% 전액 지원과 함께 AI 직무훈련 비용도 기업당 최대 738만원까지 지원되어 비용 부담 없이 AI 역량을 강화할 수 있습니다.",
    "applyStartAt": "2026-04-29T15:00:00.000Z",
    "applyEndAt": "2026-10-30T14:59:59.000Z",
    "amountMin": null,
    "amountMax": null,
    "applicantTypes": [
      "individual",
      "corporate"
    ],
    "recurrence": "once",
    "targetRegions": [
      "서울"
    ],
    "targetIndustries": [],
    "minBusinessYears": null,
    "maxBusinessYears": 10,
    "maxEmployees": null,
    "maxRevenue": null,
    "requiredCertifications": [],
    "applyTargetDetail": "서울/경기/인천/강원 소재 AI 활용,도입 수요가 있는 상시근로자 20인 이상 기업 우선 지원 기업 대상",
    "excludeTarget": "예비 창업자 제외",
    "minAge": 20,
    "maxAge": null,
    "corporationOnly": null,
    "sourceUrl": "https://www.k-startup.go.kr/web/contents/bizpbanc-ongoing.do?schM=view&pbancSn=177466",
    "sourceApi": "kstartup",
    "externalId": "177466",
    "rawMetadata": {
      "contact": "0319406896",
      "rawRegion": "서울",
      "targetAge": "만 20세 이상 ~ 만 39세 이하,만 40세 이상",
      "department": "기업교육팀",
      "rawCategory": "기술개발(R&amp;D)",